{
    "auth": {
        "user": "marviq",
        "password": "f3cb2002b79b6c0f033c516fb5d3845c"
    },
    "persno": "P10028",
    "identifier": 
    {
      "code": "762345677",
      "type": "RFIDCARD",
      "locations": [
        "PLINT",
        "TRIU101"
      ]
    },
    "locations": [
          "PLINT",
          "TRIU101"
        ]
}
